{
  "id": "task.example.minimal",
  "title": "Minimal example spec",
  "goal": "Demonstrate the minimum required fields for a valid task spec.",
  "scope": {
    "in_scope": ["src/example.py"],
    "out_of_scope": []
  },
  "acceptance_criteria": [
    "Example behavior works as described."
  ],
  "verification_plan": [
    {
      "type": "command",
      "expected_evidence": "Exit code 0",
      "required": true
    }
  ]
}
